,number,value,datetime_start,datetime_complete,duration,params_activation_fn,params_batch_size,params_clip_range,params_ent_coef,params_gae_lambda,params_gamma,params_learning_rate,params_max_grad_norm,params_n_epochs,params_n_steps,params_net_arch,params_vf_coef,state
0,0,-352.70644660000005,2024-12-29 13:37:07.847043,2024-12-29 13:49:53.515154,0 days 00:12:45.668111,tanh,16,0.3,1.7621735992658136e-07,1.0,0.99,1.0582571379040949e-05,0.7,10,8,tiny,0.4591247767433375,COMPLETE
1,1,-94.3736124,2024-12-29 13:37:07.852603,2024-12-29 13:58:19.628366,0 days 00:21:11.775763,relu,8,0.1,1.7651283313330606e-07,0.9,0.95,6.493858606005221e-05,0.8,10,256,medium,0.0846988195552113,COMPLETE
2,2,,2024-12-29 13:49:53.554789,2024-12-29 13:50:17.874086,0 days 00:00:24.319297,tanh,512,0.4,0.017561549416855598,0.99,0.95,0.8950318070889721,0.9,10,64,tiny,0.6862866430891852,PRUNED
3,3,-312.8411952,2024-12-29 13:50:17.901678,2024-12-29 13:56:22.115209,0 days 00:06:04.213531,relu,256,0.4,4.1879433150070974e-08,0.95,0.9999,0.16091905619325986,1.0,5,32,medium,0.31383462808045515,COMPLETE
4,4,-226.017431,2024-12-29 13:56:22.192684,2024-12-29 13:59:56.842424,0 days 00:03:34.649740,relu,128,0.4,0.024786117670663715,1.0,0.99,0.00011423973973515536,0.7,5,512,medium,0.2685506827718811,COMPLETE
5,5,,2024-12-29 13:58:19.634934,2024-12-29 13:59:16.204538,0 days 00:00:56.569604,tanh,64,0.2,1.4651144663503894e-08,0.95,0.999,0.5271533253336653,5.0,5,512,small,0.43698821886113504,PRUNED
6,6,-172.6103046,2024-12-29 13:59:16.213504,2024-12-29 14:04:29.153725,0 days 00:05:12.940221,tanh,128,0.1,1.5032354941505003e-05,0.9,0.995,3.696274825868504e-05,0.8,10,32,tiny,0.19115805878811898,COMPLETE
7,7,-215.2156754,2024-12-29 13:59:56.848456,2024-12-29 14:04:03.347640,0 days 00:04:06.499184,tanh,256,0.3,0.0007806195367199834,1.0,0.9999,0.0001973040309182709,1.0,5,64,small,0.8055898193886405,COMPLETE
8,8,-155.8937502,2024-12-29 14:04:03.416021,2024-12-29 14:10:48.135217,0 days 00:06:44.719196,relu,32,0.4,0.003272459835308728,0.99,0.9,1.9920685624014776e-05,0.7,5,8,tiny,0.09093131494737505,COMPLETE
9,9,-183.370637,2024-12-29 14:04:29.162677,2024-12-29 14:09:35.869836,0 days 00:05:06.707159,tanh,512,0.4,6.529748836600414e-05,0.95,0.9,2.9318527821371296e-05,0.6,10,64,tiny,0.9912302833657296,COMPLETE
