,number,value,datetime_start,datetime_complete,duration,params_activation_fn,params_batch_size,params_clip_range,params_ent_coef,params_gae_lambda,params_gamma,params_learning_rate,params_max_grad_norm,params_n_epochs,params_n_steps,params_net_arch,params_vf_coef,state
0,0,-41.475745800000006,2024-12-29 12:18:59.071667,2024-12-29 12:29:21.498580,0 days 00:10:22.426913,tanh,32,0.3,0.0009487818532423216,1.0,0.95,0.0006338916059935944,0.6,20,2048,small,0.5078778636566722,COMPLETE
1,1,-111.53102759999999,2024-12-29 12:18:59.080265,2024-12-29 12:23:29.142130,0 days 00:04:30.061865,tanh,64,0.1,0.0030508075378190276,0.92,0.999,1.979458095380431e-05,0.6,5,64,medium,0.8565973653917042,COMPLETE
2,2,-69.26912339999998,2024-12-29 12:23:29.155029,2024-12-29 12:28:23.801685,0 days 00:04:54.646656,relu,64,0.1,0.08912845487981991,1.0,0.98,0.007624382257995568,5.0,5,1024,tiny,0.08861495999528513,COMPLETE
3,3,-186.1010992,2024-12-29 12:28:23.823159,2024-12-29 13:07:45.370271,0 days 00:39:21.547112,tanh,16,0.2,7.230444565070921e-07,0.9,0.999,0.0001311613970020869,5.0,10,8,medium,0.6324217599306536,COMPLETE
4,4,-27.332195599999995,2024-12-29 12:29:21.510258,2024-12-29 12:38:21.329101,0 days 00:08:59.818843,relu,16,0.3,2.3000174711402703e-06,0.92,0.999,0.08737428294961798,0.3,10,2048,small,0.0409302994657158,COMPLETE
5,5,-430.1041964,2024-12-29 12:38:21.352495,2024-12-29 12:42:15.743595,0 days 00:03:54.391100,tanh,32,0.1,3.114413768685631e-06,0.95,0.9999,0.5338550876709411,0.3,1,64,tiny,0.6943408355315377,COMPLETE
6,6,-261.8733728,2024-12-29 12:42:15.759844,2024-12-29 13:08:32.457127,0 days 00:26:16.697283,relu,512,0.4,6.18870523313496e-08,0.9,0.98,0.0072941118062635315,1.0,20,32,small,0.6631851641063498,COMPLETE
7,7,-185.6178296,2024-12-29 13:07:45.401951,2024-12-29 13:12:17.401183,0 days 00:04:31.999232,tanh,64,0.3,5.209218554611869e-08,1.0,0.95,0.19134510473270375,0.5,1,1024,small,0.11546871413193716,COMPLETE
8,8,-257.75664079999996,2024-12-29 13:08:32.470541,2024-12-29 13:12:46.548757,0 days 00:04:14.078216,tanh,64,0.4,0.0008025318350818759,0.99,0.995,0.018787182208376173,0.8,1,256,tiny,0.37839799999537393,COMPLETE
9,9,,2024-12-29 13:12:17.415141,,,tanh,256,0.3,0.002045996263708013,0.95,0.95,0.007889880318043026,2.0,5,8,medium,0.6563894488044093,RUNNING
